{
  "candidate_id": "var-example",
  "created_at": "REPLACE_WITH_RFC3339_TIMESTAMP",
  "origin": "LOCAL_VARIATION",
  "lifecycle_state": "PROPOSED",
  "expression_state": "LATENT",
  "selection_state": "UNASSESSED",
  "signal_refs": [],
  "mutation_pressure_refs": [],
  "triggered_obligation_refs": [],
  "hypothesis": "Unresolved possibility retained for future relevant context.",
  "change": "Candidate change not yet expressed or experimented.",
  "expected_outcomes": [],
  "variation_space": null,
  "evolutionary_subject": "",
  "protected_subjects": [],
  "environment": {},
  "dependencies": [],
  "unknowns": [],
  "observation_plan": "",
  "experiments": [],
  "evaluations": [],
  "expression_history": [],
  "integration_history": [],
  "archive": null,
  "migration": null
}
